[
  {
    "id": "cc.demagogue",
    "name": "Cult Demagogue",
    "team": "chaos-cult",
    "stats": {
      "apl": 2,
      "move": 6,
      "save": "5+",
      "wounds": 8
    },
    "base": 32,
    "keywords": [
      "CHAOS CULT",
      "CHAOS",
      "LEADER",
      "DARK COMMUNE",
      "CULT DEMAGOGUE"
    ],
    "weapons": {
      "fixed": [
        "cc.w.diabolical-stave-ranged",
        "cc.w.pistol",
        "cc.w.diabolical-stave-melee"
      ],
      "options": []
    },
    "abilities": [],
    "uniqueActions": [
      "cc.a.incite-slaughter",
      "cc.a.incite-urgency"
    ],
    "figure": {
      "archetype": "cc-cult-demagogue"
    },
    "text": "The cult's preacher: a fiery speaker who goads a nearby follower into a sudden attack or a desperate rush.",
    "source": "team-chaos-cult.pdf (Jul '25); docs/spec/13-teams.md section 20.2"
  },
  {
    "id": "cc.blessed-blade",
    "name": "Blessed Blade",
    "team": "chaos-cult",
    "stats": {
      "apl": 2,
      "move": 6,
      "save": "5+",
      "wounds": 8
    },
    "base": 28,
    "keywords": [
      "CHAOS CULT",
      "CHAOS",
      "DARK COMMUNE",
      "BLESSED BLADE"
    ],
    "weapons": {
      "fixed": [
        "cc.w.commune-blade"
      ],
      "options": []
    },
    "abilities": [
      "cc.a.cut-them-down",
      "cc.a.attuned-in-purpose"
    ],
    "uniqueActions": [],
    "figure": {
      "archetype": "cc-blessed-blade"
    },
    "text": "A silent, fanatical bodyguard: it cuts down anyone who tries to flee its reach, and fights in step with its fellow.",
    "source": "team-chaos-cult.pdf (Jul '25); docs/spec/13-teams.md section 20.2"
  },
  {
    "id": "cc.iconarch",
    "name": "Iconarch",
    "team": "chaos-cult",
    "stats": {
      "apl": 2,
      "move": 6,
      "save": "5+",
      "wounds": 8
    },
    "base": 32,
    "keywords": [
      "CHAOS CULT",
      "CHAOS",
      "DARK COMMUNE",
      "PSYKER",
      "ICONARCH"
    ],
    "weapons": {
      "fixed": [
        "cc.w.burning-censer",
        "cc.w.pistol",
        "cc.w.crude-melee-weapon-iconarch"
      ],
      "options": []
    },
    "abilities": [
      "cc.a.icon-bearer"
    ],
    "uniqueActions": [
      "cc.a.ruinous-icon"
    ],
    "figure": {
      "archetype": "cc-iconarch"
    },
    "text": "The standard-bearer of the cult, whose mutating icon strengthens its followers and withers its foes.",
    "source": "team-chaos-cult.pdf (Jul '25); docs/spec/13-teams.md section 20.2"
  },
  {
    "id": "cc.mindwitch",
    "name": "Mindwitch",
    "team": "chaos-cult",
    "stats": {
      "apl": 2,
      "move": 6,
      "save": "5+",
      "wounds": 8
    },
    "base": 32,
    "keywords": [
      "CHAOS CULT",
      "CHAOS",
      "DARK COMMUNE",
      "PSYKER",
      "MINDWITCH"
    ],
    "weapons": {
      "fixed": [
        "cc.w.infernal-gaze",
        "cc.w.fists"
      ],
      "options": []
    },
    "abilities": [],
    "uniqueActions": [
      "cc.a.heinous-deluge",
      "cc.a.malefic-vortex"
    ],
    "figure": {
      "archetype": "cc-mindwitch"
    },
    "text": "A swollen head on a mindless carrier, tormenting minds and weaving vortexes of warp energy.",
    "source": "team-chaos-cult.pdf (Jul '25); docs/spec/13-teams.md section 20.2"
  },
  {
    "id": "cc.devotee",
    "name": "Chaos Devotee",
    "team": "chaos-cult",
    "stats": {
      "apl": 2,
      "move": 6,
      "save": "5+",
      "wounds": 7
    },
    "base": 25,
    "keywords": [
      "CHAOS CULT",
      "CHAOS",
      "DEVOTEE"
    ],
    "weapons": {
      "fixed": [
        "cc.w.pistol",
        "cc.w.crude-melee-weapon"
      ],
      "options": []
    },
    "abilities": [
      "cc.a.group-activation"
    ],
    "uniqueActions": [],
    "figure": {
      "archetype": "cc-devotee"
    },
    "text": "A zealous cultist who fights in pairs, and who may be reshaped by the warp after a kill.",
    "source": "team-chaos-cult.pdf (Jul '25); docs/spec/13-teams.md section 20.2"
  },
  {
    "id": "cc.mutant",
    "name": "Chaos Mutant",
    "team": "chaos-cult",
    "stats": {
      "apl": 2,
      "move": 6,
      "save": "5+",
      "wounds": 7
    },
    "base": 25,
    "keywords": [
      "CHAOS CULT",
      "CHAOS",
      "MUTANT"
    ],
    "weapons": {
      "fixed": [
        "cc.w.blasphemous-appendages"
      ],
      "options": []
    },
    "abilities": [
      "cc.a.accursed-mutant",
      "cc.a.unnatural-regeneration"
    ],
    "uniqueActions": [],
    "figure": {
      "archetype": "cc-mutant"
    },
    "text": "A devotee twisted into a bulging, regenerating horror. It exists only as a form a Devotee takes in the battle.",
    "source": "team-chaos-cult.pdf (Jul '25); docs/spec/13-teams.md section 20.2",
    "selectable": false
  },
  {
    "id": "cc.torment",
    "name": "Chaos Torment",
    "team": "chaos-cult",
    "stats": {
      "apl": 2,
      "move": 6,
      "save": "5+",
      "wounds": 13
    },
    "base": 40,
    "keywords": [
      "CHAOS CULT",
      "CHAOS",
      "TORMENT"
    ],
    "weapons": {
      "fixed": [
        "cc.w.hideous-mutations"
      ],
      "options": []
    },
    "abilities": [
      "cc.a.accursed-torment",
      "cc.a.unnatural-regeneration",
      "cc.a.brute"
    ],
    "uniqueActions": [],
    "figure": {
      "archetype": "cc-torment"
    },
    "text": "A daemon bound into a mutant's body: huge, relentless and deaf to anything but slaughter.",
    "source": "team-chaos-cult.pdf (Jul '25); docs/spec/13-teams.md section 20.2",
    "selectable": false
  }
]
