[
  {
    "id": "kom.boss-nob",
    "name": "Boss Nob",
    "team": "kommandos",
    "stats": { "apl": 3, "move": 6, "save": "5+", "wounds": 14 },
    "base": 32,
    "keywords": ["KOMMANDO", "ORK", "LEADER", "BOSS NOB"],
    "weapons": {
      "fixed": ["kom.w.slugga"],
      "options": [{ "id": "melee", "label": "Melee weapon", "from": ["kom.w.big-choppa", "kom.w.power-klaw"] }]
    },
    "abilities": ["kom.a.krumpin-time"],
    "uniqueActions": ["kom.a.get-it-dun"],
    "figure": { "archetype": "kom-boss-nob" },
    "text": "The mob leader: a slugga plus either a big choppa or a power klaw, fights twice per activation and drives the others on.",
    "source": "team-kommandos.pdf; docs/spec/13-teams.md 2.2"
  },
  {
    "id": "kom.bomb-squig",
    "name": "Bomb Squig",
    "team": "kommandos",
    "stats": { "apl": 2, "move": 6, "save": "5+", "wounds": 5 },
    "base": 25,
    "keywords": ["KOMMANDO", "ORK", "BOMB SQUIG"],
    "weapons": { "fixed": ["kom.w.explosives", "kom.w.bite"], "options": [] },
    "abilities": ["kom.a.boom", "kom.a.stoopid", "kom.a.expendable"],
    "uniqueActions": [],
    "figure": { "archetype": "kom-bomb-squig" },
    "expendable": true,
    "text": "A volatile creature trained to run at the enemy and burst; ignored by the kill op.",
    "source": "team-kommandos.pdf; docs/spec/13-teams.md 2.2"
  },
  {
    "id": "kom.boy",
    "name": "Boy",
    "team": "kommandos",
    "stats": { "apl": 2, "move": 6, "save": "5+", "wounds": 10 },
    "base": 32,
    "keywords": ["KOMMANDO", "ORK", "BOY"],
    "weapons": { "fixed": ["kom.w.slugga", "kom.w.choppa"], "options": [] },
    "abilities": ["kom.a.taktical-wot-notz"],
    "uniqueActions": [],
    "figure": { "archetype": "kom-boy" },
    "text": "Rank-and-file mob member with a slugga and a choppa; any number can be taken.",
    "source": "team-kommandos.pdf; docs/spec/13-teams.md 2.2"
  },
  {
    "id": "kom.breacha-boy",
    "name": "Breacha Boy",
    "team": "kommandos",
    "stats": { "apl": 2, "move": 6, "save": "5+", "wounds": 10 },
    "base": 32,
    "keywords": ["KOMMANDO", "ORK", "BREACHA BOY"],
    "weapons": { "fixed": ["kom.w.slugga", "kom.w.breacha-ram"], "options": [] },
    "abilities": [],
    "uniqueActions": ["kom.a.breach"],
    "figure": { "archetype": "kom-breacha-boy" },
    "text": "Demolition specialist who punches holes through thin walls with a ram.",
    "source": "team-kommandos.pdf; docs/spec/13-teams.md 2.2"
  },
  {
    "id": "kom.burna-boy",
    "name": "Burna Boy",
    "team": "kommandos",
    "stats": { "apl": 2, "move": 6, "save": "5+", "wounds": 10 },
    "base": 32,
    "keywords": ["KOMMANDO", "ORK", "BURNA BOY"],
    "weapons": { "fixed": ["kom.wg.burna", "kom.w.fists"], "options": [] },
    "abilities": [],
    "uniqueActions": [],
    "figure": { "archetype": "kom-burna-boy" },
    "text": "Flamethrower specialist with a standard spray and a short-range deluge profile.",
    "source": "team-kommandos.pdf; docs/spec/13-teams.md 2.2"
  },
  {
    "id": "kom.comms-boy",
    "name": "Comms Boy",
    "team": "kommandos",
    "stats": { "apl": 2, "move": 6, "save": "5+", "wounds": 10 },
    "base": 32,
    "keywords": ["KOMMANDO", "ORK", "COMMS BOY"],
    "weapons": { "fixed": ["kom.w.shokka-pistol", "kom.w.fists"], "options": [] },
    "abilities": ["kom.a.i-got-a-plan-ladz"],
    "uniqueActions": ["kom.a.listen-in"],
    "figure": { "archetype": "kom-comms-boy" },
    "text": "Radio operator who coordinates the mob and works objectives more cheaply.",
    "source": "team-kommandos.pdf; docs/spec/13-teams.md 2.2"
  },
  {
    "id": "kom.dakka-boy",
    "name": "Dakka Boy",
    "team": "kommandos",
    "stats": { "apl": 2, "move": 6, "save": "5+", "wounds": 10 },
    "base": 32,
    "keywords": ["KOMMANDO", "ORK", "DAKKA BOY"],
    "weapons": { "fixed": ["kom.wg.dakka-shoota", "kom.w.fists"], "options": [] },
    "abilities": [],
    "uniqueActions": ["kom.a.dakka-dash"],
    "figure": { "archetype": "kom-dakka-boy" },
    "text": "Gunner who can dash and fire in one go.",
    "source": "team-kommandos.pdf; docs/spec/13-teams.md 2.2"
  },
  {
    "id": "kom.grot",
    "name": "Grot",
    "team": "kommandos",
    "stats": { "apl": 2, "move": 6, "save": "5+", "wounds": 5 },
    "base": 25,
    "keywords": ["KOMMANDO", "ORK", "GROT"],
    "weapons": { "fixed": ["kom.w.grot-choppa"], "options": [] },
    "abilities": ["kom.a.sneaky-zogger"],
    "uniqueActions": ["kom.a.grappling-hook"],
    "figure": { "archetype": "kom-grot" },
    "text": "Small, nimble helper that stays out of sight and swings up onto terrain with a hook.",
    "source": "team-kommandos.pdf; docs/spec/13-teams.md 2.2"
  },
  {
    "id": "kom.rokkit-boy",
    "name": "Rokkit Boy",
    "team": "kommandos",
    "stats": { "apl": 2, "move": 6, "save": "5+", "wounds": 10 },
    "base": 32,
    "keywords": ["KOMMANDO", "ORK", "ROKKIT BOY"],
    "weapons": { "fixed": ["kom.wg.rokkit-launcha", "kom.w.fists"], "options": [] },
    "abilities": [],
    "uniqueActions": [],
    "figure": { "archetype": "kom-rokkit-boy" },
    "text": "Rocket specialist, firing aimed or on the move.",
    "source": "team-kommandos.pdf; docs/spec/13-teams.md 2.2"
  },
  {
    "id": "kom.slasha-boy",
    "name": "Slasha Boy",
    "team": "kommandos",
    "stats": { "apl": 2, "move": 6, "save": "5+", "wounds": 10 },
    "base": 32,
    "keywords": ["KOMMANDO", "ORK", "SLASHA BOY"],
    "weapons": { "fixed": ["kom.w.throwing-knives", "kom.w.twin-choppas"], "options": [] },
    "abilities": ["kom.a.dat-all-you-got"],
    "uniqueActions": [],
    "figure": { "archetype": "kom-slasha-boy" },
    "text": "Close-in knifework: silent throwing knives and a pair of choppas.",
    "source": "team-kommandos.pdf; docs/spec/13-teams.md 2.2"
  },
  {
    "id": "kom.snipa-boy",
    "name": "Snipa Boy",
    "team": "kommandos",
    "stats": { "apl": 2, "move": 6, "save": "5+", "wounds": 10 },
    "base": 32,
    "keywords": ["KOMMANDO", "ORK", "SNIPA BOY"],
    "weapons": { "fixed": ["kom.wg.scoped-big-shoota", "kom.w.fists"], "options": [] },
    "abilities": [],
    "uniqueActions": [],
    "figure": { "archetype": "kom-snipa-boy" },
    "text": "Sharpshooter whose scoped big shoota has concealed, stationary and sweeping profiles.",
    "source": "team-kommandos.pdf; docs/spec/13-teams.md 2.2"
  }
]
