[
  {
    "id": "gm.blood-herald",
    "name": "Goremonger Blood Herald",
    "team": "goremongers",
    "stats": {
      "apl": 2,
      "move": 7,
      "save": "5+",
      "wounds": 11
    },
    "base": 32,
    "keywords": [
      "GOREMONGER",
      "CHAOS",
      "LEADER",
      "BLOOD HERALD"
    ],
    "weapons": {
      "fixed": [
        "gm.w.icon-of-khorne",
        "gm.w.chainblade"
      ]
    },
    "abilities": [
      "gm.a.khornes-favour",
      "gm.a.impending-apotheosis"
    ],
    "uniqueActions": [],
    "figure": {
      "archetype": "gm-blood-herald"
    },
    "text": "The pack leader: a horned zealot who refills an emptied gore tank once per activation and can shrug off a single blow once per battle.",
    "source": "team-goremongers.pdf (Aug '26); docs/spec/13-teams.md 21.2"
  },
  {
    "id": "gm.aspirant",
    "name": "Goremonger Aspirant",
    "team": "goremongers",
    "stats": {
      "apl": 2,
      "move": 7,
      "save": "5+",
      "wounds": 10
    },
    "base": 32,
    "keywords": [
      "GOREMONGER",
      "CHAOS",
      "ASPIRANT"
    ],
    "weapons": {
      "fixed": [
        "gm.w.autopistol",
        "gm.w.chainglaive"
      ]
    },
    "abilities": [
      "gm.a.obsessive-bloodlust"
    ],
    "uniqueActions": [],
    "figure": {
      "archetype": "gm-aspirant"
    },
    "text": "The pack's backbone: swift chainglaive fighters who surge on to a fresh victim as soon as the last one falls.",
    "source": "team-goremongers.pdf (Aug '26); docs/spec/13-teams.md 21.2"
  },
  {
    "id": "gm.bloodtaker",
    "name": "Goremonger Bloodtaker",
    "team": "goremongers",
    "stats": {
      "apl": 2,
      "move": 7,
      "save": "5+",
      "wounds": 10
    },
    "base": 32,
    "keywords": [
      "GOREMONGER",
      "CHAOS",
      "BLOODTAKER"
    ],
    "weapons": {
      "fixed": [
        "gm.w.autopistol",
        "gm.w.ritual-blade"
      ]
    },
    "abilities": [],
    "uniqueActions": [
      "gm.a.transfusion-ritual"
    ],
    "figure": {
      "archetype": "gm-bloodtaker"
    },
    "text": "A connoisseur of spilled vitae who opens veins with a ritual knife and tops up its packmates' tanks.",
    "source": "team-goremongers.pdf (Aug '26); docs/spec/13-teams.md 21.2"
  },
  {
    "id": "gm.impaler",
    "name": "Goremonger Impaler",
    "team": "goremongers",
    "stats": {
      "apl": 2,
      "move": 7,
      "save": "5+",
      "wounds": 10
    },
    "base": 32,
    "keywords": [
      "GOREMONGER",
      "CHAOS",
      "IMPALER"
    ],
    "weapons": {
      "fixed": [
        "gm.w.autopistol",
        "gm.w.fleshskewer-ranged",
        "gm.w.fleshskewer-stab"
      ]
    },
    "abilities": [],
    "uniqueActions": [
      "gm.a.gore-fuel"
    ],
    "figure": {
      "archetype": "gm-impaler"
    },
    "text": "A harpooner who hauls fleeing prey back into the pack's reach and can burn gore to make its spear savage.",
    "source": "team-goremongers.pdf (Aug '26); docs/spec/13-teams.md 21.2"
  },
  {
    "id": "gm.inciter",
    "name": "Goremonger Inciter",
    "team": "goremongers",
    "stats": {
      "apl": 2,
      "move": 7,
      "save": "5+",
      "wounds": 10
    },
    "base": 32,
    "keywords": [
      "GOREMONGER",
      "CHAOS",
      "INCITER"
    ],
    "weapons": {
      "fixed": [
        "gm.wg.dual-autopistols"
      ]
    },
    "abilities": [
      "gm.a.incite-the-hunt"
    ],
    "uniqueActions": [
      "gm.a.dash-and-spray"
    ],
    "figure": {
      "archetype": "gm-inciter"
    },
    "text": "A fast skirmisher with no taste for melee who spills blood at range to incite the rest of the pack. It carries no melee weapon.",
    "source": "team-goremongers.pdf (Aug '26); docs/spec/13-teams.md 21.2"
  },
  {
    "id": "gm.skullclaimer",
    "name": "Goremonger Skullclaimer",
    "team": "goremongers",
    "stats": {
      "apl": 2,
      "move": 7,
      "save": "5+",
      "wounds": 10
    },
    "base": 32,
    "keywords": [
      "GOREMONGER",
      "CHAOS",
      "SKULLCLAIMER"
    ],
    "weapons": {
      "fixed": [
        "gm.w.autopistol",
        "gm.w.great-chainaxe"
      ]
    },
    "abilities": [
      "gm.a.brutish",
      "gm.a.claim-skull"
    ],
    "uniqueActions": [],
    "figure": {
      "archetype": "gm-skullclaimer"
    },
    "text": "The pack's best duellist: an oversized axe, a thick skull and a habit of collecting trophies for the war god.",
    "source": "team-goremongers.pdf (Aug '26); docs/spec/13-teams.md 21.2"
  },
  {
    "id": "gm.stalker",
    "name": "Goremonger Stalker",
    "team": "goremongers",
    "stats": {
      "apl": 2,
      "move": 7,
      "save": "5+",
      "wounds": 10
    },
    "base": 32,
    "keywords": [
      "GOREMONGER",
      "CHAOS",
      "STALKER"
    ],
    "weapons": {
      "fixed": [
        "gm.w.autopistol",
        "gm.w.pickrippers"
      ]
    },
    "abilities": [
      "gm.a.climbing-picks",
      "gm.a.rooftop-stalker"
    ],
    "uniqueActions": [],
    "figure": {
      "archetype": "gm-stalker"
    },
    "text": "A tracker who scales walls on its pickrippers and drops onto the wounded prey below.",
    "source": "team-goremongers.pdf (Aug '26); docs/spec/13-teams.md 21.2"
  }
]
